,Anzahl,Firma,Jahr,Lehrstelle,Ort
0,1,Dr. med. dent. Ksenija Nussbaum,2019,Abdichter/in EFZ,Aadorf (TG)
1,1,Dr. med. dent. Christian Greuter,2019,Abdichtungspraktiker/in EBA,Aarau (AG)
2,1,Adligenswil,2019,Agrarpraktiker/in EBA,Adligenswil (LU)
3,1,Dr.med.dent. Beat Huber,2019,Agrarpraktiker/in (Landwirtschaft) EBA,Adligenswil (LU)
4,1,Zahnarztpraxis Sunnemärt,2019,Agrarpraktiker/in (Spezialkulturen) EBA,Adliswil (ZH)
5,1,Dr. med. dent. Martin Leuenberger,2019,Agrarpraktiker/in (Weinbereitung) EBA,Aesch BL (BL)
6,1,Gemeinschaftspraxis im Strebel,2019,Anlagen- und Apparatebauer/in EFZ,Affoltern am Albis (ZH)
7,3,Clinique Dentaire d'Aigle SA,2018,Anlagenführer/in EFZ,Aigle (VD)
8,1,Dr. med. dent. Marc Bandi,2019,Architekturmodellbauer/in EFZ,Allschwil (BL)
9,1,Zahnarztpraxis Yvonne Körte,2019,Assistent/in Gesundheit und Soziales EBA,Allschwil (BL)
10,1,Zahnarztpraxis Andreas-Kim Vogel,2019,Augenoptiker/in EFZ,Alpnach Dorf (OW)
11,1,Dr. Axel Jenzsch,2019,Automatiker/in EFZ,Altdorf UR (UR)
12,1,Dr. Boris Okmian,2019,Automatikmonteur/in EFZ,Altendorf (SZ)
13,1,Dr. med. dent. Thomas Kuhn,2019,Automobil-Assistent/in EBA,Amriswil (TG)
14,1,Bojovic Dragomir,2019,Automobil-Fachmann/-frau EFZ,Appenzell (AI)
15,1,Dr. med. dent. M. Senay,2019,Automobil-Fachmann/-frau (Nutzfahrzeuge) EFZ,Appenzell (AI)
16,1,Dr. med. dent. Marjan Suntev,2019,Automobil-Fachmann/-frau (Personenwagen) EFZ,Appenzell (AI)
17,1,Dr Johnny Georges Médecin-dentiste,2018,Automobil-Mechatroniker/in EFZ,Aubonne (VD)
18,1,Dr. med. dent. Bruno Hobi,2019,Automobil-Mechatroniker/in (Nutzfahrzeuge) EFZ,Bad Ragaz (SG)
19,1,Dr.med.dent. Martin Conrad AG,2019,Automobil-Mechatroniker/in (Personenwagen) EFZ,Baden (AG)
20,1,Zahnärzte am Bahnhofplatz GmbH,2019,Bäcker/in-Konditor/in-Confiseur/in EBA,Baden (AG)
21,1,Dr.med.dent. Erik R.D. Müller,2019,Bäcker/in-Konditor/in-Confiseur/in EFZ,Bäretswil (ZH)
22,1,Dr. med. dent. Adrian Büttel,2019,Bäcker/in-Konditor/in-Confiseur/in (Bäckerei-Konditorei) EFZ,Basel (BS)
23,1,Dr. med. dent. Christoph Epting,2019,Bäcker/in-Konditor/in-Confiseur/in (Konditorei-Confiserie) EFZ,Basel (BS)
24,1,Dr. med. dent. P.A. Isler,2019,Baumaschinenmechaniker/in EFZ,Basel (BS)
25,6,Universitäres Zentrum für Zahnmedizin UZB,2019,Baupraktiker/in EBA,Basel (BS)
26,1,Zahnarztpraxis med. dent. Jan Jörgensen,2019,Bauwerktrenner/in EFZ,Basel (BS)
27,1,Zahnarztpraxis Schifflände,2019,Bekleidungsgestalter/in EFZ,Basel (BS)
28,1,Dr.med.dent. Andrés Pastori,2019,Bekleidungsgestalter/in (Berufs- und Schutzbekleidung) EFZ,Bassersdorf (ZH)
29,1,Dr.med.dent. Thomas Gusset,2019,Bekleidungsgestalter/in (Damenbekleidung) EFZ,Bassersdorf (ZH)
30,1,zahnteam4you ag,2019,Bekleidungsgestalter/in (Herrenbekleidung) EFZ,Bazenheid (SG)
31,1,Hr. Dr. med. dent. Hendrik Vogt,2019,Bekleidungsgestalter/in (Kopfbedeckung) EFZ,Beringen (SH)
32,1,Klinik für Kieferorthopädie,2019,Bekleidungsgestalter/in (Pelzbekleidung) EFZ,Bern (BE)
33,1,Praxis am Hirschengraben,2019,Bekleidungsnäher/in EBA,Bern (BE)
34,2,Universität Bern,2019,Betonwerker/in EFZ,Bern (BE)
35,1,Universität Bern,2019,Boden-Parkettleger/in EFZ,Bern (BE)
36,1,Universität Bern,2019,Boden-Parkettleger/in (Parkett) EFZ,Bern (BE)
37,1,Zahnarztpraxis,2019,Boden-Parkettleger/in (Textile und elastische Beläge) EFZ,Bern (BE)
38,1,Zahnarztpraxis,2019,Bootbauer/in EFZ,Bern (BE)
39,1,Zahnarztpraxis,2019,Bootfachwart/in EFZ,Bern (BE)
40,1,Zahnarztpraxis,2019,Buchhändler/in EFZ,Bern (BE)
41,1,Zahnarztpraxis,2019,Büchsenmacher/in EFZ,Bern (BE)
42,1,Zahnarztpraxis Kristan,2019,Bühnentänzer/in EFZ,Bern (BE)
43,1,Zahninsel GmbH,2019,Bühnentänzer/in (Klassischer Tanz) EFZ,Bern (BE)
44,1,Dr. med. dent. Andrea Stebler,2019,Bühnentänzer/in (Zeitgenössischer Tanz) EFZ,Bettlach (SO)
45,1,White Bex Sàrl,2018,Büroassistent/in EBA,Bex (VD)
46,1,Cabinet Dentaire Central,2019,Carrosserielackierer/in EFZ,Biel/Bienne (BE)
47,1,dentalcenters.ch,2019,Carrosseriespengler/in EFZ,Biel/Bienne (BE)
48,1,Zahnarztpraxis,2019,Chemie- und Pharmapraktiker/in EBA,Biel/Bienne (BE)
49,1,Zahnarztpraxis / Cabinet dentaire,2019,Chemie- und Pharmatechnologe/-login EFZ,Biel/Bienne (BE)
50,1,Zahnarztpraxis zur alten Waage,2019,Coiffeur/-euse EBA,Binningen (BL)
51,1,hiDENT Cabinet Dentaire,2018,Coiffeur/-euse EFZ,Blonay (VD)
52,1,Zahnarzt Bolligen AG,2019,Dachdecker/in EFZ,Bolligen (BE)
53,1,Zahnarztpraxis Petra Schweiger,2019,Dachdeckerpraktiker/in EBA,Bonstetten (ZH)
54,1,Dr. med. dent. Daniele Fasciglione,2019,Dekorationsnäher/in EBA,Breitenbach (SO)
55,1,Zahnarztpraxis Bremgarten,2019,Dentalassistent/in EFZ,Bremgarten b. Bern (BE)
56,1,Zahnpraxis Brugg Sead Habibija,2019,Detailhandelsassistent/in EBA,Brugg AG (AG)
57,1,Dr. med. dent. Jürg Schenk-Kuchenbuch,2019,Detailhandelsassistent/in (Autoteile-Logistik) EBA,Bubendorf (BL)
58,1,zahnarztzentrum.ch AG,2019,"Detailhandelsassistent/in (Bäckerei, Konditorei, Confiserie) EBA",Buchs SG (SG)
59,1,Lüdin Zahnaerzte AG,2019,Detailhandelsassistent/in (Consumer-Electronics) EBA,Bülach (ZH)
60,2,med.dent. Ch. Hardegger Baltensperger,2019,Detailhandelsassistent/in (Do-it-yourself) EBA,Bülach (ZH)
61,1,Ardentis Centre dentaire,2019,Detailhandelsassistent/in (Eisenwaren) EBA,Bulle (FR)
62,1,Cabinet Dentaire Gazur Sàrl,2019,Detailhandelsassistent/in (Elektrofach) EBA,Bulle (FR)
63,1,Centre Dentaire B1,2019,Detailhandelsassistent/in (Farben) EBA,Bulle (FR)
64,1,Dr Guillaume Honoré,2019,Detailhandelsassistent/in (Fleischwirtschaft) EBA,Bulle (FR)
65,1,Dr Parisod Jean-Pierre,2019,Detailhandelsassistent/in (Flower) EBA,Bulle (FR)
66,1,Ravenel Patrick,2019,Detailhandelsassistent/in (Garden) EBA,Bulle (FR)
67,1,zahnarztzentrum.ch AG Burgdorf,2019,Detailhandelsassistent/in (Haushalt) EBA,Burgdorf (BE)
68,4,Clinique dentaire de Lausanne,2018,Detailhandelsassistent/in (Kiosk) EBA,Bussigny (VD)
69,1,Dr.med.dent. Daniel Bolfing,2019,Detailhandelsassistent/in (Landi) EBA,Buttisholz (LU)
70,1,Cabinet dentaire,2019,Detailhandelsassistent/in (Lederwaren und Reiseartikel) EBA,Cernier (NE)
71,1,Dr.med.dent. A. Brunner,2019,Detailhandelsassistent/in (Möbel) EBA,Cham (ZG)
72,1,Dr.med.dent. Patrick Sequeira,2019,Detailhandelsassistent/in (Musikinstrumente) EBA,Cham (ZG)
73,1,Dr. med. dent. Braguglia Marco,2019,Detailhandelsassistent/in (Nahrungs- und Genussmittel) EBA,Chur (GR)
74,1,Dr. med. dent. Loher Christoph,2019,Detailhandelsassistent/in (Öffentlicher Verkehr) EBA,Chur (GR)
75,1,Dr. med. dent. Nay Peter,2019,Detailhandelsassistent/in (Papeterie) EBA,Chur (GR)
76,1,Zahnarztpraxis,2019,Detailhandelsassistent/in (Parfumerie) EBA,Chur (GR)
77,1,ARDENTIS clinique dentaire Chablais,2019,Detailhandelsassistent/in (Post) EBA,Collombey (VS (fr))
78,3,Clinique dentaire du Chablais,2019,Detailhandelsassistent/in (Schuhe) EBA,Collombey (VS (fr))
79,3,Clinique dentaire du Valais SA,2019,Detailhandelsassistent/in (Spielwaren) EBA,Conthey (VS (fr))
80,1,Contheydental SA,2019,Detailhandelsassistent/in (Sportartikel) EBA,Conthey (VS (fr))
81,1,Ardentis - Clinique dentaire,2018,Detailhandelsassistent/in (Teppich und Bodenbeläge) EBA,Cossonay-Ville (VD)
82,1,Zahnarztpraxis Dallenwil,2019,Detailhandelsassistent/in (Textil) EBA,Dallenwil (NW)
83,1,MÖHR ZAHNÄRZTE,2019,"Detailhandelsassistent/in (Uhren, Schmuck, Edelsteine) EBA",Dielsdorf (ZH)
84,1,Med. dent. N. Komadina,2019,Detailhandelsassistent/in (Zoofachhandel) EBA,Diessenhofen (TG)
85,1,Schulzahnklinik Dietikon,2019,"Detailhandelsfachmann/-frau EFZ, Schwerpunkt Beratung",Dietikon (ZH)
86,1,Zahnärzte Hasenberg,2019,Detailhandelsfachmann/-frau Beratung (Autoteile-Logistik) EFZ,Dietikon (ZH)
87,1,Zahnarztpraxis Löwenzentrum,2019,Detailhandelsfachmann/-frau Beratung (Bäckerei/Konditorei/Confiserie) EFZ,Dietikon (ZH)
88,1,zahnarztzentrum.ch AG,2019,Detailhandelsfachmann/-frau Beratung (Consumer-Electronics) EFZ,Dietikon (ZH)
89,1,Zahnarztpraxis Dr. E. Stevanovic,2019,Detailhandelsfachmann/-frau Beratung (Do-it-yourself) EFZ,Dottikon (AG)
90,1,Zahnarztpraxis Dr. Nadine Fenner,2019,Detailhandelsfachmann/-frau Beratung (Eisenwaren) EFZ,Dübendorf (ZH)
91,1,Ärtzepraxis Bahnhofzentrum Düdingen,2019,Detailhandelsfachmann/-frau Beratung (Elektrofach) EFZ,Düdingen (FR)
92,1,Adent Zahnarztzentrum Ebikon,2019,Detailhandelsfachmann/-frau Beratung (Farben) EFZ,Ebikon (LU)
93,1,Dr. med. dent. R. Sleiter,2019,Detailhandelsfachmann/-frau Beratung (Fleischwirtschaft) EFZ,Egerkingen (SO)
94,1,Dr.med.dent. Otto R. Notter,2019,Detailhandelsfachmann/-frau Beratung (Flower) EFZ,Egg b. Zürich (ZH)
95,1,Zahnarztpraxis Embrach-Rorbas,2019,Detailhandelsfachmann/-frau Beratung (Garden) EFZ,Embrach (ZH)
96,2,Dr.med. et med.dent. Roman Schwizer,2019,Detailhandelsfachmann/-frau Beratung (Haushalt) EFZ,Erlenbach ZH (ZH)
97,1,Dres.med.dent. Patrik Albert,2019,Detailhandelsfachmann/-frau Beratung (Kiosk) EFZ,Erlenbach ZH (ZH)
98,1,Dr. med. dent. Markus Lingg,2019,Detailhandelsfachmann/-frau Beratung (Landi) EFZ,Eschen (FL)
99,1,Dres.med.dent. A. Thieme und R.Morger,2019,Detailhandelsfachmann/-frau Beratung (Lederwaren und Reiseartikel) EFZ,Eschenbach SG (SG)
100,1,Zahnarztpraxis Duss AG,2019,Detailhandelsfachmann/-frau Beratung (Möbel) EFZ,Escholzmatt (LU)
101,1,med.dent. Urs Kelemen,2019,Detailhandelsfachmann/-frau Beratung (Musikinstrumente) EFZ,Fällanden (ZH)
102,1,Praxis Eichwiesen,2019,Detailhandelsfachmann/-frau Beratung (Nahrungs- und Genussmittel) EFZ,Fällanden (ZH)
103,1,med. dent. Stephan Müller,2019,Detailhandelsfachmann/-frau Beratung (Öffentlicher Verkehr) EFZ,Fehraltorf (ZH)
104,1,ZahnAerzte Flamatt,2019,Detailhandelsfachmann/-frau Beratung (Papeterie) EFZ,Flamatt (FR)
105,1,Dr.med.dent. Marc Raby,2019,Detailhandelsfachmann/-frau Beratung (Parfümerie) EFZ,Flawil (SG)
106,1,Dr. med. dent. Anita Wehrle Lechmann,2019,Detailhandelsfachmann/-frau Beratung (Post) EFZ,Flims Waldhaus (GR)
107,1,Zahnarztpraxis/Kieferorthopädie,2019,Detailhandelsfachmann/-frau Beratung (Schuhe) EFZ,Flums (SG)
108,1,Dr. med. dent. Andreas Ettlin,2019,Detailhandelsfachmann/-frau Beratung (Spielwaren) EFZ,Frauenfeld (TG)
109,1,Dr. med. dent. Andreas Lüthi,2019,Detailhandelsfachmann/-frau Beratung (Sportartikel) EFZ,Frauenfeld (TG)
110,1,Zahnarztzentrum.ch AG,2019,Detailhandelsfachmann/-frau Beratung (Teppich und Bodenbeläge) EFZ,Frauenfeld (TG)
111,1,Cabinet dentaire Dr Bernard Ponnaz,2019,Detailhandelsfachmann/-frau Beratung (Textil) EFZ,Freiburg (FR)
112,1,Dr Juvet Laurent,2019,Detailhandelsfachmann/-frau Beratung (Uhren-Schmuck-Edelsteine) EFZ,Freiburg (FR)
113,1,Dr. Hostettler Jacques,2019,Detailhandelsfachmann/-frau Beratung (Zoofachhandel) EFZ,Freiburg (FR)
114,1,Dr. Schellenberg Marc,2019,"Detailhandelsfachmann/-frau EFZ, Schwerpunkt Bewirtschaftung",Freiburg (FR)
115,1,Zahnarztpraxis Schneuwly Bachmann,2019,Detailhandelsfachmann/-frau Bewirtschaftung (Autoteile-Logistik) EFZ,Freiburg (FR)
116,1,Dr. med. dent. Silvan Hersberger,2019,Detailhandelsfachmann/-frau Bewirtschaftung (Bäckerei/Konditorei/Confiserie) EFZ,Frenkendorf (BL)
117,1,Dr. med. dent. P. Maurer-Lupinc,2019,Detailhandelsfachmann/-frau Bewirtschaftung (Consumer-Electronics) EFZ,Gerlafingen (SO)
118,1,Zahnärzte im Gemeindezentrum,2019,Detailhandelsfachmann/-frau Bewirtschaftung (Do-it-yourself) EFZ,Geroldswil (ZH)
119,1,Dr. S. Saulacic & Dr. V. Perunski,2019,Detailhandelsfachmann/-frau Bewirtschaftung (Eisenwaren) EFZ,Geuensee (LU)
120,1,Dr. Müller Otto,2019,Detailhandelsfachmann/-frau Bewirtschaftung (Elektrofach) EFZ,Givisiez (FR)
121,1,Cabinet dentaire Dresse Schulthess,2018,Detailhandelsfachmann/-frau Bewirtschaftung (Farben) EFZ,Gland (VD)
122,1,Cano & Zimmermann,2019,Detailhandelsfachmann/-frau Bewirtschaftung (Fleischwirtschaft) EFZ,Glattpark (Opfikon) (ZH)
123,1,Dr. med. dent. A. Wedig,2019,Detailhandelsfachmann/-frau Bewirtschaftung (Flower) EFZ,Glis (VS (de))
124,1,Zahnarztpraxis,2019,Detailhandelsfachmann/-frau Bewirtschaftung (Garden) EFZ,Goldach (SG)
125,1,José Diodatti,2019,Detailhandelsfachmann/-frau Bewirtschaftung (Haushalt) EFZ,Gossau SG (SG)
126,1,Wittig Dental,2019,Detailhandelsfachmann/-frau Bewirtschaftung (Kiosk) EFZ,Gossau SG (SG)
127,1,Evi'dent SARL,2019,Detailhandelsfachmann/-frau Bewirtschaftung (Landi) EFZ,Grône (VS (fr))
128,1,Zahnarztpraxis Milanovic,2019,Detailhandelsfachmann/-frau Bewirtschaftung (Lederwaren und Reiseartikel) EFZ,Gurmels (FR)
129,1,Edelweiss Dental,2019,Detailhandelsfachmann/-frau Bewirtschaftung (Möbel) EFZ,Hasle LU (LU)
130,1,Zahnarztpraxis Zupan,2019,Detailhandelsfachmann/-frau Bewirtschaftung (Musikinstrumente) EFZ,Hausen am Albis (ZH)
131,1,Dr.Dr. med.dent. M.Leupold-Hlawitschka,2019,Detailhandelsfachmann/-frau Bewirtschaftung (Nahrungs- und Genussmittel) EFZ,Heerbrugg (SG)
132,1,Zahnarztpraxis Dr. med.dent.Heiko Herzbe,2019,Detailhandelsfachmann/-frau Bewirtschaftung (Papeterie) EFZ,Heerbrugg (SG)
133,1,HeidenSmile AG,2019,Detailhandelsfachmann/-frau Bewirtschaftung (Parfümerie) EFZ,Heiden (AR)
134,1,Zahnarztpraxis Armin B. Fürer,2019,Detailhandelsfachmann/-frau Bewirtschaftung (Post) EFZ,Herisau (AR)
135,1,Zahnarztpraxis Dr. med. dent. A. Loboda,2019,Detailhandelsfachmann/-frau Bewirtschaftung (Schuhe) EFZ,Herisau (AR)
136,1,Zahnarztpraxis Raphael E. Egli,2019,Detailhandelsfachmann/-frau Bewirtschaftung (Spielwaren) EFZ,Herisau (AR)
137,1,Zahnmedizin Wiesental,2019,Detailhandelsfachmann/-frau Bewirtschaftung (Sportartikel) EFZ,Herisau (AR)
138,1,Zahnpraxis Dr. Bernhard Schenk AG,2019,Detailhandelsfachmann/-frau Bewirtschaftung (Teppich und Bodenbeläge) EFZ,Herisau (AR)
139,1,Dr. med. dent. Helen Mang Buckman,2019,Detailhandelsfachmann/-frau Bewirtschaftung (Textil) EFZ,Herrliberg (ZH)
140,1,Zahnarztpraxis,2019,Detailhandelsfachmann/-frau Bewirtschaftung (Uhren-Schmuck-Edelsteine) EFZ,Herzogenbuchsee (BE)
141,1,Dr.med.dent. Thomas Hofstetter,2019,Detailhandelsfachmann/-frau Bewirtschaftung (Zoofachhandel) EFZ,Hitzkirch (LU)
142,1,Praxis für Zahngesundheit,2019,Diätkoch/-köchin EFZ,Horw (LU)
143,1,Zahnarztpraxis Dr. Gabriel Dorn,2019,Drogist/in EFZ,Hünenberg (ZG)
144,1,Zahnarztpraxis,2019,Drucktechnologe/-login EFZ,Huttwil (BE)
145,1,Dr. med. dent. Jürg Schmid,2019,Drucktechnologe/-login (Bogendruck) EFZ,Ilanz (GR)
146,1,Dr. med. dent. Schlatter Daniel,2019,Drucktechnologe/-login (Reprografie) EFZ,Ilanz (GR)
147,1,Dr.med.dent.Thomas Tanner,2019,Drucktechnologe/-login (Rollendruck) EFZ,Jona (SG)
148,1,Praxis am Lenggisrain,2019,Drucktechnologe/-login (Siebdruck) EFZ,Jona (SG)
149,1,Dr.med.dent. Patricia Hassler,2019,"Medientechnologe/-login (Print) EFZ, in Anhörung",Kaltbrunn (SG)
150,1,Zahnarztpraxis,2019,"Medientechnologe/-login (Printmediatechnik) EFZ, in Anhörung",Kirchberg SG (SG)
151,1,Dentis Praxis,2019,"Medientechnologe/-login (Siebdruck) EFZ, in Anhörung",Kloten (ZH)
152,1,Gmür Zahnärzte,2019,"Edelstein-/Diamantenschleifer/in (EFZ, Kt. Regl. TI)",Kloten (ZH)
153,1,Dr. Judith Aufenanger,2019,Elektroinstallateur/in EFZ,Küsnacht ZH (ZH)
154,1,Zahnarztpraxis Dr. B. Ritter,2019,Elektroniker/in EFZ,Küsnacht ZH (ZH)
155,1,Dr. Andreas Kohler,2019,Elektroplaner/in EFZ,Küssnacht am Rigi (SZ)
156,1,Küssadent AG,2019,Entwässerungspraktiker/in EBA,Küssnacht am Rigi (SZ)
157,1,Dr. med. dent. Silas T. Räber,2019,Entwässerungstechnologe/-login EFZ,Laax GR (GR)
158,1,Dr. med. dent. Susanne Schönheid,2019,Entwässerungstechnologe/in (Sanieren von Entwässerungsanlagen) EFZ,Lachen SZ (SZ)
159,1,Zahnarztpraxis,2019,Entwässerungstechnologe/in (Untersuchen von Entwässerungsanlagen) EFZ,Langenthal (BE)
160,1,Praxis für Zahnmedizin,2019,Entwässerungstechnologe/in (Warten von Entwässerungsanlagen) EFZ,Langnau im Emmental (BE)
161,1,Dr. med. dent. Thomas Imhof,2019,Fachmann/-frau Betreuung EFZ,Laufen (BL)
162,1,weber zahnärzte laufen ag,2019,Fachmann/-frau Betreuung (Behindertenbetreuung) EFZ,Laufen (BL)
163,2,Ardentis - Clinique dentaire du Flon,2018,Fachmann/-frau Betreuung (Betagtenbetreuung) EFZ,Lausanne (VD)
164,1,Ardentis - Clinique dentaire Lausanne,2018,Fachmann/-frau Betreuung (Generalistische Ausbildung) EFZ,Lausanne (VD)
165,1,Ardentis Clinique dentaire EPFL,2018,Fachmann/-frau Betreuung (Kinderbetreuung) EFZ,Lausanne (VD)
166,1,Cabinet dentaire Dr Pierre Gaumet,2018,Fachmann/-frau Betriebsunterhalt EFZ,Lausanne (VD)
167,1,Cabinet dentaire Faivre,2018,Fachmann/-frau Betriebsunterhalt (Hausdienst) EFZ,Lausanne (VD)
168,1,Centre du Sourire,2018,Fachmann/-frau Betriebsunterhalt (Werkdienst) EFZ,Lausanne (VD)
169,1,Dr Brazzola Pierre Médecin-dentiste,2018,Fachmann/-frau Bewegungs- und Gesundheitsförderung EFZ,Lausanne (VD)
170,1,Dr Peter Möller,2018,Fachmann/-frau Gesundheit EFZ,Lausanne (VD)
171,1,JO2 - Médecine Dentaire SA,2018,Fachmann/-frau Hauswirtschaft EFZ,Lausanne (VD)
172,1,Zahnarztpraxis,2019,Fachmann/-frau Information und Dokumentation EFZ,Liebefeld (BE)
173,1,Linthpraxen Zahnmedizin AG,2019,Fachmann/-frau Kundendialog EFZ,Linthal (GL)
174,1,Brunner Praxis für Zahnmedizin,2019,Fachmann/-frau Leder und Textil EFZ,Luzern (LU)
175,1,Dr. med. dent.,2019,Fachmann/-frau Leder und Textil (Fahrzeuge und Technik) EFZ,Luzern (LU)
176,1,Dr.med.dent. Markus Thaler,2019,Fachmann/-frau Leder und Textil (Feinlederwaren) EFZ,Luzern (LU)
177,1,Dr.med.dent. Niels Büttner,2019,Fachmann/-frau Leder und Textil (Pferdesport) EFZ,Luzern (LU)
178,1,zahnarztpraxis falkengasse,2019,Fachmann/-frau öffentlicher Verkehr EFZ,Luzern (LU)
179,1,zahnarztzentrum.ch AG,2019,Fachmann/-frau öffentlicher Verkehr (Planung) EFZ,Luzern (LU)
180,2,zahnarztzentrum.ch AG,2019,Fachmann/-frau öffentlicher Verkehr (Zugbegleitung) EFZ,Luzern (LU)
181,1,Zahnarztpraxis,2019,Fachmann/-frau Textilpflege EFZ,Lyss (BE)
182,1,Zahnarztpraxis Constance Mähler AG,2019,Fachmann/-frau Textilpflege (Textilreinigung) EFZ,Madiswil (BE)
183,1,Dres. med. dent.,2019,Fachmann/-frau Textilpflege (Wäscherei) EFZ,Männedorf (ZH)
184,1,Zahnarztpraxis Zimmermann,2019,Fahrradmechaniker/in EFZ,Männedorf (ZH)
185,1,Ducry Alexandre,2019,Fahrzeugschlosser/in EFZ,Martigny (VS (fr))
186,1,Dr.med.dent. Claude Villard,2019,Fassadenbauer/in EFZ,Meilen (ZH)
187,1,Dr.med.dent. Hans-Peter Gschäll,2019,Fassadenbaupraktiker/in EBA,Meilen (ZH)
188,1,Leutert Zahnärzte,2019,Feinwerkoptiker/in EFZ,Meilen (ZH)
189,1,Zahnarztpraxis,2019,Fleischfachassistent/in EBA,Meiringen (BE)
190,1,Dr. Valérie Dormenval,2018,Fleischfachassistent/in (Produktion und Verarbeitung) EBA,Mézières VD (VD)
191,1,DorfZahnarzt,2019,Fleischfachassistent/in (Vorbereitung und Verkauf) EBA,Mönchaltorf (ZH)
192,1,Adent Cliniques Dentaires Groupe SA,2019,Fleischfachmann/-frau EFZ,Monthey (VS (fr))
193,1,Cabinet dentaire Des Dents du Midi,2019,Fleischfachmann/-frau (Feinkost und Veredelung) EFZ,Monthey (VS (fr))
194,1,Cabinet dentaire Dentalys,2018,Fleischfachmann/-frau (Gewinnung) EFZ,Montreux (VD)
195,1,Denta,2018,Fleischfachmann/-frau (Verarbeitung) EFZ,Montreux (VD)
196,1,Dental-First sàrl,2018,Flexodrucker/in EFZ,Montreux (VD)
197,1,Dentistes-Hartmann SA,2018,Florist/in EBA,Montreux (VD)
198,2,Ardentis - Clinique Dentaire Morges,2018,Florist/in EFZ,Morges (VD)
199,1,Dr Villars Louis,2018,Formenbauer/in EFZ,Morges (VD)
